,subreddit,text
237,Etsy,"Throwaway because I don't want it attached to my account

I had a customer order something, which was shipped within my processing time. After some time they contacted me to ask where the package was because they hadn't received it. I said I would look into it and get back to her asap. 

The tracking wasn't showing any update information, I looked into it and the shipping company said they couldn't locate it. Sucks, but these things happen especially these days. 

I sent out a second package and after it had already sent, the customer said they didn't want it anymore. 

I told her I couldn't refund her since the second package was in transit and she started going off how unprofessional it was for me to send out another order, she didn't believe the package was lost, I must be lying or just forgot to send it because she had received other packages from other places no problem. 

She started making all sorts of accusations about me and my business and how dare I blame the pandemic. She said she if I didn't refund her immediately etsy would force me to. 

She's now opened a case saying I'm refusing to refund her and Etsy should stop me selling on the platform! 

I've already lost money on the order, by having to send a second package, I really don't want to refund this person who will get their money back and the items and I will be out three times on it. 

This person and their messages ruined my day yesterday and she's still messaging today. Not sure what to do.Difficult Karen"
238,Etsy,I’ve been on Etsy for several years now and haven’t taken the leap to not solely rely on Etsy. With forced Etsy-ads and their poor customer service..I’m ready to branch out. Have you had success with Shopify or anything else? I have no interest in eBay or anything like that. Thanks!Transitioning away from Etsy?
239,Etsy,"So I bought something in early February, that just entered pre-transit on the 7th. However, it was supposed to arrive between the 10th and today and has not gotten here. Even worse it still says it's in pre-transit. I've contacted the seller 2 times this week and they have yet to respond. I don't really know what to do yet ik many Etsy sellers and buyers have had this problem so is there anything I can do?Package still stuck in Pre-Transit?"
240,Etsy,"I paid $20 ($14 + shipping) for about 24 pieces of candy when I was supposed to recieve twice the amounts because the seller mixed up the order. 

i contacted the seller the day the candy arrived on the 16th of february and she was extremely sweet and helpful, she was very apologetic about her mistake and told me she shipped out a replacement package with the correct order the following day with some extra goodies to compensate. 

when she was mentioning this, she did not give me a tracking # of the correct order she was shipping out, but i figured she probably just forgot and it would arrive soon enough because she shipped it so quick! 

now it’s almost a month later and the package she claims to have sent out with the correct order still hasn’t arrived? i don’t know what to think. even in the worst of USPS times during december of 2020 it never took this long to receive a package...

she’s in florida and i’m in massachusetts so it’s not even traveling that long of a distance. 

many of her recent reviews are not great as well —  many complaining of long shipping times and incorrect orders……😳 

yesterday i messaged her and said that i hoped she was doing well, and that it was okay if the package potentially hadn’t been scanned yet, but that i would like a tracking #. 

she has yet to reply and it’s been a whole day so i am kind of not expecting a response. 

in the case that she doesn’t respond do you think i should file a dispute on etsy and will my images of the candy i received, packaging and messages be enough to cover me? i feel terrible that i have to do this but i also can’t afford to have spent that much on candy and only receive half of what i paid for. i also paid with paypal as opposed to card - will the $ go back on my paypal?Unfortunate situation with seller :("
241,Etsy,Really want an elegant/unique hair stick and was wondering if y'all had any favorite shops for them!!Hair stick shops?
242,Etsy,"So I recently got the first round of the covid vaccine (Moderna) and it totally wrecked me, I was so sick with aches, fever, nausea, etc. I didn’t realize it would make me so sick and I had orders to make and send out the next day and it just wasn’t going to happen so I had to send messages to everyone explaining why I’m sick and that I would get them out ASAP but just not by the date I had originally set them to go out on. I’ve heard that the second shot is worse, so what I’m wondering is if I put my shop on vacation mode this time will it hurt my sales once I turn it back off? Any advice/experience is appreciated!Vacation Mode"
243,Etsy,"Hello! I recently opened an Etsy shop about 3 months ago. I mostly sell cake pops, brownies, and those chocolate breakable hearts/bears. Before I opened the shop, I did read into the California Cottage laws but it restricts you from selling online. I use cake mix, flour, sugar, eggs, Guittard chocolate, etc in my products, but if something were to happen, will I get in trouble. I try my best to follow the laws (even though i never received my license). For example, when making my products, I don't allow my dogs or any children within the room I am making them, I wash my hands thoroughly and wear FDA approve gloves, I even wear a mask just in case and bc my face is sort of close to the products, etc. Should I be worried? Thank you!Do I need a license to sell?"
244,Etsy,"I'm asking this because I purchased an item but the seller DMed me and said it's no longer in stock, so when I ask for a refund would I need to give my card information or would Etsy automatically send the money back to me?

Yes I know my question is dumb but tbh I don't 100% understand how cards work in terms of refunding.How do I get a refund on an item on Etsy?"
245,Etsy,"So I placed an order for a poster back in February on the 13th, and it arrived on Monday (3/8). When I looked at the poster I was a bit disappointed because the resolution looked bad. It looked like the seller took the image and just made it bigger which made a few areas of the poster look super out of focus. So I decided to shoot them a message the same day asking about it. They haven't responded to me yet. I was hoping to get an answer and go from there, but now I kinda just want a refund and look elsewhere for a poster. 

I plan to shoot them another message today, and if they don't respond by next week, I think I'm going to have to open a case with Etsy about it (is this the right way to go about it? I've never had to do this before. Most sellers I have bought from have been stellar so far!)

But I'm just wondering if I'm giving the seller enough time to respond since I know things can be hectic. What do you guys think?Am I being fair enough in this situation?"
246,Etsy,"Hiiiyya any UK Etsy sellers here who are give my basic information about how I should do my tax?

I opened a shop as a hobby just for pocket money. But I read that I need to register with HMRC if my gross income is more than 1000 GBP a year? Last year I got around 600 and this year from Jan-March I've already got over 1000 so do I apply with HMRC now? and how do I do? where I am soo lost but I want to follow the law at least .

Also I heard we can claim VAT and stuff? I'm clueless please help me. THANK YOU!ETSY UK sellers? Tax? HMRC?"
248,Etsy,"Hello, 

I would like to sell a product that lets the customer choose 6 unique skeins of yarn for a needlepoint kit but etsy only lets me create 2 unique variations. Is there anyway around this? Here is the listing for reference:  [DIY Needlepoint Kit Tapestry Kit Blank Template Zip-around | Etsy](https://www.etsy.com/listing/970460023/diy-needlepoint-kit-tapestry-kit-blank?ref=shop_home_active_1&amp;frs=1) 

&amp;#x200B;

Thank you,

MagnusMultiple variations help (seller)"
249,Etsy,"Just wondering if anyone else experiences this problem? or is it specific to my post office?

I'm at the post office 2-3 times a week, dropping off an assortment of different packages. Most are scanned within 1-2 days, if not the very same day, but poster tubes have been taking a week or more to enter the system.Shipping tubes stuck in pre-transit longer than boxes/polymailers?"
250,Etsy,"I've been doing some shopping, and have been digging deep for items that match what I'm looking for. I buy pop culture items regarding 80s, 70s, and 90s movies. Which Etsy doesn't have a huge market for. I was interested in more stuff than I've already bought and have coming in. So if you have any cool products listed that match the description, please share! I don't know if this is the place to ask but oh well.Looking for products"
251,Etsy,"I ordered an item from the US for £68, paid £19 for delivery, and 20% for VAT (£17) taking the total to £105- when it arrived, it was detained as VAT charges were due.

I paid the VAT again, (another £18) and put in a query with HMRC - I sent them my invoice, showing VAT had already been applied, but they then recalculated it based on the price paid + delivery + the vat paid to etsy, sending a new VAT invoice based on the item being worth £105. 

Does the VAT charged at the point of purchase actually go to HMRC, or does it go to the seller? Should the seller pay the VAT? Totally confused as to why you get charged VAT on the point of purchase if you're going to have to pay it again when it gets to you.What happens to the VAT charged on Etsy purchases?"
252,Etsy,"Anybody else having any issues with the Etsy site on PC as of right now?  
I just keep getting "" This Site Isn't Working"" no matte what URL I tryEtsy Connection Issues Via PC"
253,Etsy,"I got a custom order February 10th for some shorts. I cut and sew them together, print out the label, package it up and drop it off near my local bin right before midnight. Fast forward to today, that customer who ordered on the 10th is still waiting for their package. I checked tracking and it's stuck on ""pre trainst"". All my packages since the 10th have been delivered successful. 

What should I do here? Is my package lost?Canada post Stuck in Pre-transit"
254,Etsy,"For example: An item being sold on etsy for $15 is advertised on Facebook via a sponsored page, that links to a third party website and the same item is being ""sold"" for $35 (not including the shipping fees)I've been seeing a lot of Etsy resellers on Facebook disguised as reputable businesses. Is this a common trend?"
255,Etsy,"I think etsy broke. Clicking on store icon or profile just has the ""a stitch has gone"" error, and its being very slow. Anyone else's etsy acting up?Etsy broken for anyone else?"
256,Etsy,"So I'm based in the UK and had a customer order a somewhat pricy item from my shop as a surprise gift for a child. I always post my orders out the same day so it gets there the next day most of the time. But the customer messaged me yesterday asking for a tracking number so she could see just how far the item had reached. 

I gave it to her and checked the tracking myself only to find that it is sitting in a post office after the postman was unable to delivery it (no one answered the doorbell). It was been two days. 

Customer was amazing!! She called the building that the gift was supposed to be delivered at. They said they hadn't seen it. I was getting worried because 1. It's a gift. 2. I don't want to mess up my new etsy experience. Then she gave me the phone number and I called the building. Nothing. Because the postman did not drop a ""something for you"" card. Customer then drove for 20 minutes to a post office to find out more info. Delivery was rearranged for today and yay, it's been delivered. 

I apologised to the customer because her surprise for a child's birthday was ruined. She said I had nothing to apologise for. I'm just proud of the way she handled things and the way I did too. It wasn't her fault and it wasn't mine. It was Royal Mail :/ 

I just wanted to add that I have ordered from etsy and always make sure I leave a feedback etc. Sweet customers truly do make a difference. So if you ever have an issue with a buyer, please give them a chance to rectify and vice versa! 

Have a good weekend!My best customer yet!"
257,Etsy,"For those of you who have yet to see, Etsy appears to have changed it’s viewing format on at least the mobile website.

I have yet to see if this is the same on desktop.

In my personal opinion, I’m not a fan of the change. Perhaps it will take a while for it to grow on me, but I just find the gaps in the portraits ugly and distracting. It makes seeing all the thumbnails more difficult.

It reminds me of when someone is trying to fit a paragraph of text alongside an image in their PowerPoint, so they squish it to the side to make it fit.

In general, it just seems like such a waste of space to force all of the images into a weird portrait mode like this.

Again, I haven’t checked what it’s like on desktop.

I don’t mind if Etsy decides to go in this peculiar design direction, but I do hope they change how it looks on mobile.

I love Etsy and this format definitely would **not** cause me to abandon the site. It’s just a personal preference of mine.

I’m interested to hear your takes on the new format!Thoughts on the new viewing format?"
258,Etsy,"G'day fellow sellers,

I am planning to open up a second store and I was wondering if it is possible to invite myself with another email and get refferal bonus listings? Has anyone done this before?   
Do you know if this is possible or does this go against Etsy's rules?Opening another store with your own referral?"
259,Etsy,"I just want to motivate you guys a little bit! I see so many stories about Karens and awful buyers, that I want to share a positive one with you that happened recently :) 

tl;dr: 

I sent a small item to a buyer, it never arrived. After 3 months I sent off a new one which resulted in about -11€ loss for me. A few days after I sent the item off, the buyer contacted me saying, that the first one did arrive. They then offered to pay in full for the additional one. I was very happy about that and proposed that I would omit shipping for them, so that I would be able to just cover my losses without making any profit from the sale(s) and save they buyer about 10€. Every party was happy with that :)

\_\_\_\_\_\_\_\_\_\_\_\_\_\_\_\_\_\_\_\_\_\_\_\_\_\_\_\_\_\_\_\_\_\_\_\_\_\_\_\_\_\_\_\_\_\_\_\_\_\_\_\_\_\_\_\_\_\_\_\_\_\_\_\_\_\_\_\_\_\_\_\_\_\_\_\_\_\_\_\_\_\_\_\_\_\_\_\_\_\_\_\_\_\_\_\_\_\_\_\_\_\_\_\_\_\_\_

&amp;#x200B;

So I sell small animal plant pot hangers ( Pretty much animals that you can decorate your plant pots with). Their sales price and thus my margin is not very high. (About 10 € per piece with  4 € material cost, not factoring in labor time)

A while ago in mid-December I got an order for one of them, so I sent the product on its way with tracked shipping. All was well until about 2 weeks ago, when the buyer contacted me about never receiving her order. She wasn't in any way rude, she just inquired about where it might be. Sure enough, I check the shipping and it went from Germany to Overseas fine, but in the destination country it had been stuck in ""Pre-Transit"" since Dec 20th (So over 3 months!). The buyer and I considered the package lost and since its the sellers responsibility, I sent off another one with tracked shipping for which I paid 17€ out of pocket (Materials + shipping, not considering labor time). So now, with my extremely small margin, I sat at about -11€ loss from this sale alone. 

&amp;#x200B;

Then, just a few days ago I get another message from the buyer "" I just received the first package. Thank you for sending the other one anyways! As soon as it arrives, I will pay for the second one!""

&amp;#x200B;

I was so astounded, since most buyers wouldve probably never contacted me about the first package, let alone offer to pay for the second one! Since it is and was my responsibility as a seller to get the product to them and I thought their offer was so generous, I told them that I would omit the shipping fee, so that what they pay for the second one covers my losses, but I won't make any profit from it. They and I are both happy with this arrangement and now we're just waiting for the second product to make it to them!

&amp;#x200B;

I also contacted postal services about the absurd shipping time/loss of the item but of course they never got back to me :) Despite me purchasing insurance for said shipment.

&amp;#x200B;

I hope you will encounter a buyer as honest and friendly soon!A story to motivate you - the opposite of a Karen!"
260,Etsy,"Whats up everyone, this is a repost from about 2 months ago but I wanted to revisit the topic as it has now been 90 days without an update on my etsy purchase from Russia to U.S.A. With excessive delays in international shipments, when would be a good time to ask for a refund? The seller said his last package took 102 days so I am thinking until then, and after I will ask for a refund, does everyone agree? Has anyone's international packages taken longer? 

The seller put a lot of time and quality effort into this product and I have been patient. I have not gotten an update since it was released from Russian post on 12/13/20. 

Thank you and God Bless everyone!
-JordanItem purchased from Russia to USA and no updates since Dec 13th, 2020. What to do??"
261,Etsy,"Is there anything I can do about this? I sell digital smart displays, and had a return due to some damage. I sent them a return label via Etsy (about $30 cost) and told them to use the original packaging. They took it to Fedex and they packaged it in a huge box with expandable foam and then I got charged $240 for oversize fees! 

Is there anything I can do about this now or tips to avoid it in the future?

Dave - MatterofFractions.comCustomer Return = $240 charge"
262,Etsy,"Hi everyone. I placed an order for a plant on Feb 13. The seller had a note that said she would take a couple weeks to ship, but that was fine because it was super cold. I started paying attention around March 1. A shipping label was generated, so I expected my plant to arrive soon. Nope. Never actually was put in the mail. Now the seller has 'temporarily' stopped all sales and is 'taking a break.' I've tried messaging only to be met with automated responses. I went through the Etsy 'help with an order' process and requested a refund, but because a shipping label had been generated, I had to wait until yesterday to be able to open a case. Miraculously, yesterday, the shop owner replied with an apology and said she would ship today (yesterday). New shipping label generated. However, it's still marked as pre-transit. While I've been waiting, the shop's reviews have taken a nosedive with multiple customers describing this exact same experience. I'm doubtful I'm going to get my plant, but I can't open a case because of the shipping label thing. How do I get my money back?

&amp;#x200B;

Edit to add: Seller never responded or shipped. I did have to open a case, and Etsy refunded my money. What a horrible experience. Thank you to everyone who responded. It was very helpful. Help for a buyer please--item hasn't shipped, seller not communicating"
263,Etsy,"I've been dabbling in creating digital art during the pandemic and I feel like I am at a place where I can offer my art for sale! But when it comes to the download stage I'm stuck!

How do I go about sizing digital art in order for it to be accurately printed by a customer at 4x6, 5x7, etc etc etc? 

Do I size the file at 1200x1800pixels for 4x6, etc? Is it by pixel size like that? I tried sizing the file on Canva in inches and it didn't work.To all digital art sellers who use Canva"
264,Etsy,"Hey guys!

So I’m trying to find the best mockups for prints to put in our Etsy shop. Placeit has a lot of great mockups for wall art that I’ve found, and it’s been recommended over and over and over again in videos and blog posts that I’ve researched. 

But last night, my partner and I uploaded some mockups into the spot where you put your product pictures, and it gave us the warning “pictures look best when they’re 2000px on their shortest side”, meaning our mockups weren’t big enough. Literally none of the mockups we found seem to be that big to start with.

So what gives? People recommend this site ALL THE TIME. And yet their mockups are all too small for Etsy.

We fudged our first listing by just putting them in Canva and making them be 2000px by 2000px by dragging the mockup bigger, but that diminishes the quality and is just another added step that feels tedious. And a lot of the features of the mockup get lost when we expand them in our 2000px by 2000px template, like a bed will get cut out or most of the set will get cut out.

How do you all Placeit users get around this? We can’t afford and don’t have the skills for Photoshop. Are there any other freemium sites that actually HAVE Etsy-size-approved mockups without having to make them bigger in Canva before posting them?  What would you all recommend?Placeit Mockup images too small for Etsy product pictures"
265,Etsy,"Advertising with a decent budget and sales have plummeted:(!

Anyone else? We did $70-80K revenue over November , December and im struggling to get $2000-$3000 over Feb and MarchIs anyone elses sales gone down drasticly?"
266,Etsy,"Sold item at $99.99 + $8.72 (Shipping) + $8.01 (tax) = $116.72  
I see the follow transactions from Etsy:  
Listing Fee = $.20  
Etsy 5% = $99.99 \* .05% = $5.00 (rounded up)  
\^ these I expect and understand

  
Tax?? = $116.72 - $104.96 = $11.76 - $8.01 = $3.75  
Random = $.44 (labeled as 'shipping transaction')  


I am very confused as to why I have two random transactions of what I guess is extra tax and then some weird transaction. Could someone shed some light as to why please?  


Thank you in advance.Am I Missing Something In My Math?"
267,Etsy,"I’ve recently made the full transition to more sustainable packaging. I sell greeting cards and art prints. All of my products and packaging are either recyclable (eg, my paper products) and/or recyclable and biodegradable (eg, my plastic sleeves for shipping).

I will include details of what I use in my descriptions but I was wondering if I could also include something in my banner indicating this as well.

I don’t want to mislead anyone so would including something like “eco-friendly products and packaging” be misleading in anyway? I would explain in further detail in my shop’s “About” section as well as on each product listing page. From what I’ve researched, “eco-friendly” is a pretty vague term.

Thank you so much in advance!Being “eco-friendly”"
268,Etsy,"First, does ETSY have any rules against importing my product reviews into my woo site?

Second, does anyone know an easy way to do it?Importing reviews to woo commerce site"
269,Etsy,"Those of you who actually get sales THAT COME THROUGH ETSY, not traffic driven by you, do you pay extra for ads? Is it worth it?Etsy ads?"
270,Etsy,"My friend went to buy some digital art from me and was charged a ridiculous increase. It is a ""physical product"" because it is custom. The shipping of course is free. 
The product is $5.30 and she was charged $6.97
There is picture proof it is the only thing in her cart.
That is a 33.4% increase! Where she lives, the tax is 7.75% so what is going on here!? Are all of my poor customers getting robbed?Etsy charging my customers 33.4% tax!!??"
271,Etsy,"I've got an Etsy shop, offering personalised items and a separate website.

Is it possible to somehow let my users fill in their custom text on my website and then add a link to the Etsy shop so that the text gets carried forward and populated automatically?Is it possible to pass custom text directly into Etsy?"
272,Etsy,"Currently in my gift baskets I have paper shred, because paper shred is better for ""holding things into place"". One of my friends saw a letterbox package that had tissue paper in it and she suggested I use this instead for people who don't like stuff that goes everywhere (but my concern is tissue paper typically does not hold things in place as well as shred). What is your guys' opinions?Would you prefer paper shred or tissue paper in your letterbox gift basket?"
