,subreddit,text
741,Etsy,"Went to log in today and Etsy does not recognise my email address and my shop has disappeared from etsy. Help! Anyone else had this happen?

Have put in a support call, so really hoping it can be sorted quickly.My shop has disappeared!"
742,Etsy,"Hi there.

I wanted to verify bank account ( United Kingdom ) received test deposit after it went back to Etsy to verify it. 

Once I press verify button the box where I should type in sum I received is greyed out and you can't type in anything. Same with verify button.  

See screenshot: 

https://ibb.co/LtgBVVZ


Is that smth new ? Or I have to wait more ? 

Anyone got some information about this ? 

ThanksVerify bank account greyed out. Can't process to verify."
743,Etsy,"Hey Guys, quick question I'm just getting startet with Etsy as an Seller. I started my first Marketing Campaign over a week ago with a daily budget of 5$ so far no sales. 

I've now done more research and picked the wrong Goals at the beginning not selecting ""drive more sales"".

I've been wondering since where do I change the Goals for Etsy Ads and does it really make a difference?

I've been looking for over an Hour not able to find it, hope you guys may help out.

Kind regardsEtsy Ads: Can't change Goals"
744,Etsy,"Hi all, hopefully this is a good place to ask. 

I’ve been wanting to purchase a rug from Morocco from Etsy. (I live in the US)

However, i have no idea how to navigate paying duties? How to not get it held up in customs? How expensive the import will be (I’ve done multiple calculators and some say it will cost nothing bc it’s under 800 US dollars. And some say I will owe upward of 500 dollars for import)

I can’t find any clear info about how I deal with this stuff. It’s all very convoluted. 

Does anyone have an experience about importing into the US. 

DO I EVEN NEED TO DO ANYTHING? will it just magically arrive? 

Sorry for the dumb dumb question. Any help is appreciated:) 

It’s a wool rug, approx 1.5 meters x 2.75 meters selling cost 450 USDFirst time international buyer"
745,Etsy,"This is the worst shipping issue I've ever had. In my experience with PE, about 25% arrive one day late. I've never had any arrive later than that, and this is the first one that's ever been lost. 

WORST part? The buyer, knowing they were ordering last minute, had it sent to the location they were traveling to, which actually gave the order an extra 3 days to arrive. When it didn't, she was there for a few days, so later was good too. So, even a very very late delivery, would still have been totally fine (she just needed it to be there). I am devastated that it didn't arrive in time, but am so relieved to be working with one of the kindest buyers I have ever had. 

I refunded, she reordered, and all is good on that end.

I filed an insurance claim on USPS. I'm just really shocked it hasn't been found. I thought PE packages were on another level. The last scan was at my own distribution center.Priority Mail Express Order LOST"
746,Etsy,"Hey everyone, I hope you’re all okay and your shops are thriving. 
So I’ve been on Etsy since November and I was selling just sticker packs until recently when I started making 420 friendly resin art too. I hadn’t really had any issues with customers in the early part but I have read a load of your horror stories about customers lying/scamming etc. Due to the price of my stickers I didn’t think it was worth the cost of signed for post as it’s literally half the price of the stickers and I don’t charge postage. 
Recently I’ve had a massive influx of customers saying they didn’t get their orders but other people who were sent out with those letters have had theirs weeks before? 
Like I get one or two that get lost in post I’m not worried about those but like 5-10 is a joke right? 
What can I do? I don’t have the cash to stay afloat As I’ve put everything into this already and now I’m waiting for a return. Please can someone help me!!!!

And if you’re a customer who is getting their items from any small business then claiming you don’t, then shame on you!ABOUT TO SHUT MY SHOP DOWN BECAUSE OF LYING CUSTOMERS?"
747,Etsy,"Feeling grateful to have my 2 best days online selling cross stitch patterns but can't quite figure out where it's coming from. I've looked at my stats and it looks like Facebook and Google but I haven't posted anything recently (only to IG, not linked to my FB accpunt). Are there any trusted independent ""experts"" to look at stats and help you understand why the sudden increase in traffic? I'd love to know my secret lol 🤣Looking for an etsy stat expert to help me figure out why sales suddenly increased!"
748,Etsy,"Sorry if title is odd, but didn't know how else to word it. Everything I upload to etsy for listings...it turns out darker when I view it on desktop. Video &amp; still photo. Does this happen to anyone else?Upload Image Issue, Darker than usual?"
749,Etsy,"Hi, as the title says I've just received a sale today customer has sent me a private note asking me to mark it as a gift to avoid paying VAT. I'm in the UK and am shipping it to Ireland.
I've never had someone ask me this.
Is it illegal?Customer wants item marked as a gift to avoid VAT"
750,Etsy,"Hey! I had a buyer from the UK purchase 2 things in a row a few days ago, and paid $15 shipping twice, but the destination is the same address. I messaged them immediately to ask if they’d like me to ship the 2 items together and refund one of the shipping costs, but they haven’t responded, and I’d like to get them shipped out today.

I use etsy’s international shipping labels and have had issues with them, so I’m tempted to just ship the items together in 1 so I don’t have to send multiple packages to the same address, but what should I actually do? It seems wasteful for me or the buyer to spend $30 on shipping 2 tiny things separately to the same place, but I don’t want to refund the shipping and send them together if there is any conceivable reason why the buyer would want them separated.Quick question about international order"
751,Etsy,"I recently moved my shop because of some complicated things and had to start fresh. Which meant leaving almost 100 five star reviews, which are very important to customers. But I was looking forward to getting rid of the few bad reviews, which weren't for very reasonable reasons. I was so excited to see that my first review was a five! Then my heart sank as I saw that the same person left two four star reviews. With my old shop I might be a little let down and just move on, it's a lot better than anything below that. But then I noticed that my shop now showed 4.5 stars filled. As an Etsy customer myself, I know this is not good for bringing new customers, many have a full five stars to brag. I messaged the person right after they reviewed asking them anything I can do to improve their experience and have yet to receive a reply. I'm so bummed that someone would do that to a new shop... They could at least say what was wrong! Now all I can hope for is that my other customers bring the score up to five. I already include cards that mention leaving a review, but I've never had the best success, so if anyone has tips for getting reviews let me know!Bummed by first reviews"
752,Etsy,"I have had my shop for several years now and I’ve only processed a few returns. I sell jewelry I make and they are all pendants. However, most of them have stood out because people receive the necklaces, only to message me saying they want a refund because the pendant is larger than they thought it would be. 
I always include measurements in every listing. I don’t really understand how people could miss this. Maybe they don’t measure or visualize how big the pendant is?
My question is: do any of you have experience with this? I always process the returns once I receive the item but...I hate returns. In your option, is returning an item because ‘it’s too big’ a valid reason? Or should I restrict the returns only if it’s damaged? 

Maybe I’m being too picky but to me returning a simple item like a pendant necklace just because you didn’t understand the measurements is...weird.Buyers returning"
753,Etsy,"Been having doubts about the free shipping offer and possibly disabling that, along with a bit of a dry spell a few weeks a ago but this weekend was great! Super happy right now! Hoping this year will keep growing 🤞🤞Anyone else having really good sales this year? My revenue is up 60%!!"
754,Etsy,"So a friend and I want to sell some t-shirts but we are trying to make it that a certain percentage of the money gets divided into more than one person. Is there an easy way to do this? Do you have any suggestions?

I’m sorry if I didn’t explained myself English isn’t my first language.How to share profit?"
755,Etsy,"Hello!   
So I hate Etsy's built in shipping tool. It always overcharges, and I don't even know how to put in that I'm sending out a card with a flat item in it, it seems to insist thats impossible to me. Because of this, I have shipping set up as free, but I had to turn it off for outside of the US after having one sale where literally all the payment of the item went to shipping. Now I have someone in France who'd like to buy several items from me, but I'm not sure how to go about handling this. I've seen people do individual listings before, should I figure out the shipping cost and do that do you think? Or I guess, is the shipping tool fine and the problem is me?How to handle shipping around the world?"
756,Etsy,"i’m a minor, who just opened a shop (StarLightCharmsCA) and so i got my moms help with everything. but we were both mega confused when setting up shipping lol. i’m only shipping in canada, but we were wondering if there’s a shipping option where we just throw it in the mailbox (bare with me here, i have no clue what anything shipping is lol). there’s so many confusing things, i just want to be able to package my order and throw it in the mailbox! and i’m guessing that means shipping would be free since im in canada and i’m only shipping in canada + i wouldn’t need to go to the post office for everything.shipping, help!!"
757,Etsy,"Hi, I'm hoping to buy an extender for a bodysuit. I skimmed etsy but didn't see the right type of snap and I'm not sure if snaps are universal to any extent. 

I took pictures (linked below) but there are 3 snaps which are about 1/2 inch wide. The whole section of fabric is 2 inches wide. The snaps' two outermost edges for the snaps are 1 and 11/16ths inches apart. The center of the snaps fall at 1/8th, 13/16th, and 1 and 9/16ths of an inch.

The material says 95% polyester, 5% elastaine. I don't really care if the material matches, though it would be nice. 

https://ibb.co/XXvpffx

https://ibb.co/XyqSFWJ

https://ibb.co/qmDqw1X

https://ibb.co/0nLRS3Z


If you're able to make this, please let me know your rates and turnaround time! I'm in Oregon, USA for shipping estimate. Thank you!Looking for an extender for a bodysuit/leotard"
758,Etsy,"I got an order last week, sent a sale confirmation message to the buyer. She specified that it was a gift for her mother. Great, no problem! I shipped 2 days later (well within ship by date) Usually I like to check the delivery status on my shipments just to make sure nothing is late but I've been extra busy this week. Get a notification that I have feedback, it's from her - 

""1 out of 5 stars   Where is my package?! It’s been 5 days and I have been waiting on this special gift for my mother’s 89th birthday. It was supposed to arrive on Saturday and didn’t then they said today by 9:00. Still not here, I am soooo disappointed and actually really mad."" No message from her before hand or anything. Luckily the damage doesn't seem to be too bad... All of my other reviews are 5 stars so it doesn't seem to have effected shop rating and the review doesn't come up first on the default ""recommended"" review setting.

I have lived in fear of this moment lol. Etsy is my main source of income and having worked in the service industry for many years I know exactly how vindictive and thoughtless customers can be when they believe they have been wronged.

So my question is- in your opinion, what is the best way to deal with this? Should I pm her and try to resolve? I have a feeling that the birthday has already passed. In the future I will definitely be asking if there is a deadline when the order is marked as a gift. Should I respond directly to her comment explaining my position? I'm honestly tempted to refund the order since it was not very big, but it's definitely possible she will still leave up her negative review. Idk. Any advice appreciated, thanks. You guys are awesome.My first 1 star review :,( In your experience what is the best way to do damage control"
759,Etsy,"So I sell jewelry on Etsy and Depop and I have an Instagram page where I promote and do some behind the scenes etc..  I followed an influencer who has a similar aesthetic to what I sell and she followed, commented and liked a few things. I would like to ask her if she’d be interested in receiving a few items from my shop that she can promote. I was wondering if anyone has ever done this if so how do you reach out to them and what do you say? Any tips will be helpful. Thank youHow to get small influencers to promote my brand"
760,Etsy,"I have a really identifiable name and privacy is important to me.

I have yet to start my etsy shop so maybe I'm getting ahead of myself, but I'm already thinking of using a PO box, too, because I don't like the idea of using my home address either.

If I opt to use my etsy shop name on packages, do I have to register it with DBA?

Is DBA only for those with business license or no?

Would it be a concern with the PO BOX/USPS if I use my etsy shop name?Would it be okay to write etsy shop name on packages rather than own name?"
761,Etsy,So I use letter mail to ship my items because they are small. But I’m Etsy’s brain it wants to charge $20+ for international shipping. I just want the cost for 3 stamps to be included. Can anyone help me with how to fix that in my store??Question on shipping
762,Etsy,"A competitor’s friend outright accused me of copying her friend’s product! The thing is, they look nothing alike and it’s literally not possible (I sell WordPress themes — you can’t just look and copy, you’d need to have access to the full theme/back end to even get close). I was able to figure out they’re friends by looking at the seller’s Instagram and finding the messenger, who has ~150 followers and is followed by both the biz and personal accounts of my competitor.

Part of me wants to reply but logically I feel I shouldn’t. I do feel awkward now, like my shop is being watched even though I’ve done nothing wrong. And, I don’t think I can do anything about it through Etsy either, because it didn’t come directly from my competitor’s account. I’m just wondering if any good could come out of replying? Has anyone dealt with something similar before?Should I reply to a competitor’s friend’s accusation?"
763,Etsy,Just wondering how other shops have been doing :) ?Anyone else having a relatively slow February?
764,Etsy,"Hello everyone,

I bought an item from Israel back in November of 2020 (Black Friday Weekend) which had been shipped on December 2nd, 2020. I received a tracking number and waited for the estimated arrival time which was between late December and early January. I had received one tracking update for the whole time. Just before the estimated arrival time was up, I got in touch with the seller and they told me that some packages had been returned due to a mistake in the mail - They sent me pictures of the packages and told me they would re-ship with a new tracking number.

So on January 05, 2021 my order was re-shipped under the new number and the last update I have is from January 10, 2021 saying that it was 'Sent to Canada'. There are no 'Estimated Arrival Dates' in any websites.

I got in touch with the seller and they told me to wait another 5-10 business days, has anyone had experience with Israel Post delivery to Canada (North America) recently?Israel Post"
765,Etsy,"Hello everyone, I'm interested in opening up shop in Etsy but im not sure what to clear beforehand on the legal and tax side before I start posting items. Like do I need a tax id or something if the sort? Does the state I reside matter? Can someone guide me to make sure everything runs smooth?Getting Startes"
766,Etsy,"Hi everyone! I have been looking for a silicone necklace that is actually cute, for my baby to chew on instead of my nice silver ones. I found this, but it ships from the UK 😕

https://www.etsy.com/listing/906566951/pearl-silicone-necklace-breastfeeding

I like neutral colours and simple designs, I'm don't really wear much jewelry. TIA!Looking for silicone necklace!"
767,Etsy,"Hey everyone, so I have just logged on to my etsy dashboard and came across this message: ""The taxpayer ID \[VAT ID\] you submitted is incorrect. Update the taxpayer ID on file for your shop."" 

I believe this applies for businesses who earn over £80,000 per year, which I am no where near. 

I don't know how, or if I can, get a VAT/taxpayer ID. 

Any advice is welcome :)VAT ID (UK)"
768,Etsy,"I have a customer who has been messaging me non stop. Been going on since Jan about things I’m selling or it seems just to chat. I have been very gracious and respond fairly quickly. They have purchased two of my items. However, they have changed their review when I don’t respond to a message within a time of their liking. They changed it three times now. My question is are we able to block someone?Odd customer"
769,Etsy,"I’m curious if anyone has any issues adding Green Dot to their account to buy from others? I can’t add to my Etsy or Steam but have zero issues with the same info on other sites like EBay, GameStop, etc. Green Dot made some fraudulent claim and said they can’t do anything until I threatened to leave them. Told me to retry later and contact again as it has been escalated. But yet they allow EBay when it’s just at risk as Etsy is. So I’m wondering if anyone else has this issue or if anyone does not and I’m somehow doing something wrong.Green Dot"
770,Etsy,"I have some canvases that I sell, and they were selling pretty well. I recently (approximately a month ago) added the option to add personalization to my canvases (like ""To mom, love nameyName for example) for a bit extra.

The views for my canvases, have gone down, and my sales have gone down a lot too. I've only had a couple canvas orders this month, far less than usual.

Does anyone know why this might be?Popular item category went down in sales after I added the option to add personalization"
771,Etsy,"How should I list my Etsy products ?

I’m looking to start up my Etsy shop soon and I’m going to be doing phone cases with stickers . They will be put on by me . The only thing is I’m not sure how to list buying options . Because I’m planning on getting bulk stickers from various placing so every phone cases will be different . I notice when people sell them they have a post for each specific design they can do . But how can I list them if every phone case will be different? Can I make it a option to do kinda a “you get what you get option” ? 
And maybe add a special request option for a bit higher price 
Or would it be wise just to avoid that situation all together and make only certain design optionsHow should I list my products ?"
772,Etsy,"Hi! First post here, I’d really like to find a nice gift for my roommate from hopefully one of your lovely stores! 

My roommate is a dear friend of mine but gifts are always tough for her in particular, mostly because were just very different! She does like skincare, health trends, specialty food items. Gift sets are also super cute, I think! 

If anyone has any recommendations, I’d love to hear and check out some shops!Looking for a gift - soap, skincare, gift sets"
773,Etsy,"Hello everyone,

I have had an etsy store for several years now, as a part-time thing. Recently I encountered this strange situation, and I was wondering if anyone has ever experienced something similar, or has   
any advice on how to handle it.

So- right when I first started my etsy I made a custom-made item for a customer which was very intricate and for which, in hindsight, I was probably underpaid. Recently that same customer messaged me a picture of this item, and asked if I could make him something similar. He had apparently forgotten that I was the person who originally made him that item. I replied, explaining that I had made it, and asking why he wanted another copy of it.

He then seemed to remember me, and explained that he had gifted the original item to a friend, and now regretted it. Finding this kind of strange, I googled his name and soon found a website selling many items in the same category as mine (I'm trying to be vague), where mine was also listed as 'SOLD'. He had sold my item for 4x the amount I charged, and I suspect he was planning to do this again. I replied with a link to the website, asking if he re-sold my item and expressing that I felt uncomfortable about him doing so without being honest about it, and never got a proper reply. 

Does anyone know if this goes against Etsy's policies? I feel uncomfortable about the whole situation (especially the dishonesty), but I'm not sure if this is actually abnormal

Thanks!Customer re-sold an item bought from me"
774,Etsy,"I was thinking about using Pattern through Etsy. If you all don’t know what Pattern is, it’s what Etsy uses so we can have our own website. I wanted to use it because it’s cheaper $9 that Shopify which is like $29 a month. 

Are any of you using Pattern?Do any of you use Pattern on Etsy?"
775,Etsy,"I can google it, too (and will be researching more), but also wanted to ask what people with experience have done.

I guess it differs by state as well, but I was wondering if there is a just a general list to follow for those in the US, or what you personal felt were the pros/cons of each were.

Would it be better to start off the first year as a hobby to ""see how it goes"" before doing all the paperwork that small business entails? Or would it be better to do small business first so that I have more tax write offs?

Just wanted to learn from some people's experiences.

Please be kind. I've had a few snarky responses asking questions and it's a bit weird that some people want to be condescending to people who are starting.  Please remember we're all a beginner at some point.When starting your shop did you first start it off as a ""hobby"" (in terms of taxes) or did you right off the bat sign up for it as a sole proprietorship/small business? If doing the latter what documents/sign ups are generally needed?"
776,Etsy,"Hi, community!

Im new to Etsy and I wonder if it feel correct and appropriate to bargain with seller about a price? 
I found some used jacket I like, but it's quite expensive and I'm thinking if I should try and ask seller if he could make a price a bit cheaper. 
Something like: ""I'm sorry if you'll find it inappropriate, but may I ask if price could be discussed a little bit?""
This item was placed last November, so maybe the seller will be glad to offer like 10 % discount on it and sell it at last. But I don't want to be impolite, so any advice much appreciated.

Thank you in advance!Newbie question: Is it appropriate to bargain on Etsy?"
777,Etsy,"Hi! So I bought a keychain from DanganDepository on February 9th. It’s supposed to ship in 3-5 days, but on the 14th, the seller contacted me and said there would be a delay of about a week. Alright, I understand and I’m not in a rush to get a keychain. They said they’d tell me when it shipped. 

I was planning on waiting until March 9th (a month after the order) and then messaging them if it still hasn’t shipped, but today I noticed it says the shop is taking a break. I messaged them asking if it’s still coming, and I got an auto response that just says they’re working on fulfilling their orders. I don’t want to bother them, but when should I be worried?

update it shipped! I guess I was just a bit impatient lol. Gonna take a couple weeks but hey as long as it gets here I’m good.Item Hasn’t Shipped?"
778,Etsy,"Sent some greeting card size letters UK to USA this week. They contain my fridge magnet inside a greeting card to hold them. I have been using Royal Mail International Standard letter size £1.70 through Etsy which also provides the appropriate CN22 customs form. Though when I used a different post office for my third trip of the week to vary my daily allowed walk the lady there said a letter would not require a CN22, only a parcel. 

Am I creating potential delays by keeping the Etsy printed CN22 on my letters going out to USA? Or am I doing the right thing in current climate by being up front about what I am sending out?

CheersUK Royal Mail International Standard - letter: CN22?"
779,Etsy,"I opened my etsy account in May and routed the deposit to my brothers bank account (it wasn't a super well-thought out decision, I just wanted somewhere to deposit funds and didn't have my own bank account at the time). Can I change the bank account info to a different person or did I mess myself up?

I now have over 1k sales and I am worried I messed up my account ownership.Did I mess up my account ownership?"
