,subreddit,text
502,Etsy," I have an Instagram page where I promote my jewelry and I engage with my customers and other seller and even made a few friends, I made a group chat with a few sellers and we all share tips on selling and help each other out with sales and boost each other’s posts and help with questions etc. I created a certain bracelet that’s gotten really popular and I’ve made many sales from it, other sellers who also make bracelets are asking where I got the beads from or ask me for links. I don’t feel like it’s appropriate to give them that information, I normally don’t gate keep and I’m very open with sharing where I get certain products but I feel like I should maybe draw the line when it comes to what I’m selling cause it doesn’t make sense to share that information. I also noticed a few of the other sellers copy a lot of the things I do I normally don’t care but it’s getting a bit annoying. 

I know of some sellers who make others pay for their vendor list. For me I would rather not share it. I already shared with another seller who asked me and she was a bit rude about it and learned my lesson. Am I wrong for this? please let me know. And if I’m right what should I answer them when they ask without being rude? 
Thanks


Edit: since writing this I had 3 more people ask where I get my things and another asking to use an idea I came up with it’s getting really annoying now! And I appreciate all the responses thank youShould I tell other sellers where I get my products"
503,Etsy,"So I was told to use Pirate instead of USPS, but then i heard sometimes it's even more expensive. I def wanna wean off using USPS (wait times and $) - best recs? thanks!Best shipping platform / website? So confusing"
504,Etsy,"Hello! 

I sell stationery on Etsy and I have transitioned to no tracking order to all of my orders being tracked. I used to sell my sticker packs with free shipping, so all orders placed would be sent out with a stamped envelope. This did not work out well as almost 10 of my orders shown up missing just as of last month. I can’t track the order so I can’t tell if it’s delayed, lost, or the customer simply scammed me. Of course, according to the customer, I have either refunded or replaced said item, however being a small business, I can’t afford to do this anymore. I know that if an item is deemed lost, then the shop owner is responsible for it but I don’t feel as if it’s fair that I have to pay for USPS’ mishaps. Since I found no other advice, I updated my shop so that all of my orders are tracked as of recently but unfortunately, my traction has gotten lower due to the fact that I added tracked shipping only. 

Since I sell domestically, tracking does not go over $4. However if I do sell stickers then I don’t know if customers would think it’s worth it to buy something that’s equal to the shipping price.

I feel like I’m asking for the obvious but I can’t seem to find other help elsewhere. Is no tracking worth it? Should I go back to offering free shipping and get many customers or offer tracked shipping only and get little to no traction?Is no tracking worth it?"
505,Etsy,"I'm so annoyed. I turned on Vacation Mode 2 months ago, and I haven't opened the sellers app since. I've gotten notifications of ""favorites"" and just silenced them. However, I just got an email about an order, though no notification at all. I opened the app and Vacation Mode was toggled off, which I did not do.

I've had my shop on vacation because I've had hyperemesis gravadium and have been hooked up to an IV bag. It's so hard to function day-to-day that I've been staying with my parents, so I'd need to make a special trip home just to complete the order. I explained to the customer that my shop was supposed to have been on vacation and gave him the option of a refund, or a slight delay in shipping. Either way, is this something that I need to worry about happening after my baby is born? There's no way that after a c-section I'm going to want to get a surprise order. 

Has this happened to anyone else? Is there an expiration on vacation mode where it automatically turns back on?Vacation Mode turned itself off"
506,Etsy,"After Etsy started using Asendia, I had a bad experience with an international package being stuck in limbo for a long time without updated tracking info. A bunch of people in the Etsy forum recommended Pirate Ship to avoid this kind of thing because they'd ship directly to the country rather than to a local facility where the labels would be switched. 

I got an email yesterday from Pirate Ship saying that they had to start using Asendia. So, is it pointless to use Pirate Ship now for international shipping? Are there any rate differences?So, Is Pirate Ship Pointless Now?"
507,Etsy,"New to Etsy just made my first sale and want to make sure I’m doing everything right! If I’m reading it correctly my shop manager tells me the package is in transit, I printed the label last night when the post office was closed and dropped it off this morning. I was going to mark that it was dropped off at the post office but couldn’t find the button like I saw before I printed the label. Any help is appreciated 😌Does your order automatically get marked “in transit” when you print the shipping label?"
508,Etsy,"I have a sticker store. Most of my stickers are $3-4 and I ship them first class letter mail due to them being so light so that I can offer free shipping for my customers. Customers can choose to upgrade to tracked shipping if they want to for approximately $3, but most don't unless they're placing a big order.

This buyer in particular placed an order in the beginning of February. I shipped out the order. Two weeks-ish later, they contact me to say it hasn't arrived. Etsy's dismal letter tracking also shows it hasn't yet arrived, it stopped in a city along the way and tracking hasn't updated since. I send out another order since they only ordered one thing, I'm willing to pay out of pocket to try it again, so I confirm with the buyer that the address is correct and ship again. Another two weeks go by and they say that it still hasn't arrived (Going from Seattle to Texas). They want me to ship out a third order with tracking. At this point after sending the second one free, I went from profit to breaking even, at this point sending out a third, especially with the cost of tracked package, I'm going to be paying them to take it.

I'm tempted to cut my losses and say I am unable to continue to attempt to fill the order, refund the buyer, and apologize that USPS seems to be incapable of finding their address, but what would you all do? I don't know if they're saying they didn't arrive because they want multiples which would be odd because my stuff is pretty cheap, but I can't afford to keep sending out orders to an address that clearly doesn't seem to be working.

I offer tracked shipping if people want to pay for it but I don't want to force it due to the fact it would double my buyers' costs. I've had about 250 orders in my shop so far, this is the first one that hasn't arrived.When would you just cut your losses and just refund a buyer?"
509,Etsy,"I’m wondering because people in my town/nearby could want to buy something of mine, and instead of spending $ for shipping, I’d be willing to drop it off. Is there any way to choose this method for shipping? Plus, I’d hate to waste space on mail truck for something so local, ya know?Is there a way to do local drop off instead of shipping an item?"
510,Etsy,"I am switching over to craftybase for my bookkeeping after finding that neither quickbooks nor godaddy were going to work well for me without a whole lot of extra work. 

I work in mixed media and have figured out how to track pretty much everything else except for junk jewelry. Some of it I get for free, some of it I buy in lots off of ebay. Thank god it's not something I use a ton of, but many of my pricier pieces incorperate it or are made out of it almost entirely. I could go by the piece but most of it gets totally deconstructed and used part by part. I could go by weight, but even pieces made totally out of junk jewelry have weight added from adhesives and stuff, and sometimes parts are removed and discarded as well. Also some pieces are made with some new components and some junk jewelry. To make it more complicated, the lots I have gotten have included inexpensive costume stuff, vintage stuff, and sterling silver/semiprecious stones. I charge more for pieces that incorperate vintage, silver, and gems compared to the items that don't. Like a lot more sometimes. 

At this point, since I spent so little on it last year, I'm considering just adding it as a non-inventoriable expense and then just not including it in COGS data. But at least for going forward, what kinds of workable systems have others worked out?How in the hell are you supposed to track COGS when you purchase materials is huge mixed lots?"
511,Etsy,"I'm planning on popping the question very soon and my dog is gonna help. I'm planning on her surprising her with a picnic in the park. I need the banana to be white with the words ""turn around"" in black cursive letters on it and then on the flip side, the date 2/13/2021. I also need it sent in discrete packaging so she doesn't know what it is lolCustom Dog Bandana"
512,Etsy,"I found a ring a really like on google images.  It's unique/ vintage (from the 40's), and has a cheap gemstone. It must be one-of-a-kind, as I can't find it anywhere else online. The site that has the picture sold the ring for $95 two years ago.

I stumbled upon what looks like the exact same ring on Etsy today--the same size, stone ct, etc...for $395.  What a markup!

Half of my brain is telling me that the seller found a good deal and is now selling it for market price. The other half is telling me that the seller is going to rip someone off.  I'm new to Etsy (having only bought a shirt and mug)...and have never made a large purchase.  The seller has 75 positive reviews and almost a perfect rating...but has no return policy as far as I can tell.  

Any thoughts/ advice.  I am IN LOVE with this ring, but don't want to pay $400 for a $90 piece of junk that looks nice in the photos.Thinking about buying very marked up (320%) jewelry form a seller with good reviews. Thoughts?"
513,Etsy,"I got 3 orders in a row with incomplete or weird addresses that I couldn't find on Google maps. I usually contact the customer when this happens and double check I got everything right.
One in particular was an international address and the customer says she got it right. It's a $3 product sent from the US to the UK as a letter with international stamps (so no tracking). I say the odds of her getting her purchase are 60%.What's the standard procedure when a customer provides the wrong address?"
514,Etsy,"I see a lot of people complaining about receiving packages beyond delivery estimated time. Yes, it’s frustrating to purchase something and have it arrive beyond your purchase or holiday. However, leaving negative reviews on the shop/product is just you being a jerk. 

If you live in the States, then you should know better. We all know that the USPS is backed up and has been backed up since our whole “save the post office” and “help out small businesses”, due to COVID-19 and influx with online purchasing.

I could say that I’ve been purchasing from Etsy for those exact reasons. Yes, some packages arrive quicker than others, but that doesn’t say anything about the shop. It says that certain counties have less workers. Example, I live in a metropolitan area, and my friend’s dad works at the local post office. He says that we are receiving mail to be processed from the other side of the country, just to be processed here and sent back over there. Why? Because we need more workers. Why? More purchases, consumerism, quick delivery.

So what does this have to do with reviewing items on Etsy? Well, one should be reviewing the product and or shop. What was your interaction like? How was the product? Was it what you expected? We don’t purchase on Amazon, receive things beyond the promised 2 day shipping, then go back and give the Amazon app a 1 star or a, “if I could, I would give it zero stars because my package was late.” Like, c’mon people! It’s not the shop’s fault your package came late! Use your friggen noggin, figure out (constructively) the actual reasons you’re upset, and remember that your negative review hurts small businesses.

I am not a seller. I am a woman who reads reviews before buying, and I just got a little irritated having to sift through reviews that complain about something that has nothing to do with the shop or product, and all to do with postal services. Don’t get me wrong, I appreciate those negative reviews that talk about the product or customer service, because frankly, I’m not trying to support negative shop owners or spend money on poor product.

Also, while I’m here and in this rant.. **if you know it’s Christmas and most people shop on the app during or for holiday, look for presents throughout the year instead of last minute. Chances are, your package will arrive on time! Any super last minute purchases could be on Amazon or in person. That way, you don’t backfire trying to help small business with your negative review that it arrived late.

Update: thank you so much for the awards and upvotes! I truly hope that you and your businesses have much success this year.. and hopefully, more buyers will use their noggin and give more constructive reviews. I agree, taking the stars out would definitely help! Wish nothing but the best for you lot :)A friendly reminder on postal delivery and reviewing shops or products"
515,Etsy,"Hi Everyone,

So I've been selling since around September last year and have had 15 sales so far. However, I only have one review of my least sold product back from when I first started. Are there any suggestions on how I am able to get reviews from buyers? I have made business cards that suggest leaving a review but still no luck. 

Thank you.Getting Reviews"
516,Etsy,"Hello,

My wife and I are running small handmade jewelry business.
We sent a package to the customer with custom order at February, 12 from MD to TX with First Class package and today we found that it's still in transition and located somewhere in distribution center in MD.  I opened case with USPS, wrote apologies to the customer. Proposed her either refund or new items. Is anything else I can do? Can I push USPS to investigate this case? And how long this investigation takes?Package stuck in transition. What to do?"
517,Etsy,"Hey guys, I’m a new Etsy seller and prior to this I’ve only used the Etsy labels generated on the site. How can I upload an external tracking number? And will that effect anything?How can I upload my own label?"
518,Etsy,"For a week or so, our Orders Dashboard had an invalid address badge right on the main Dashboard page under the order's shipping address (didn't need to open the order fly-out), so you could see at a glance if the shipping address submitted had an issue with it before shipping. 

They disappeared again though, so I'm assuming it was a test by Etsy... but damn, I miss it already! I don't use Etsy to make labels with, so it was great to have the tip off through Etsy's address validator that we needed to doublecheck it.

Is anyone seeing these on their end? I'm hoping it's still being considered as a new feature!'Invalid Address' Badges test on Orders Page?"
519,Etsy,"Hi all,

I design branding and packaging for small businesses on Etsy and I'm starting to receive international orders. Currently, I design, send to print and my printer ships directly to my customers but they won't ship to international customers even if I send them shipping labels. This is where my issue comes in. I've done it to one order - have them printed, shipped to me then shipped to my customer but this process is taking forever. Do you guys know any forwarder in the US where my printer can ship the item and that forwarder can then ship to my international customer? Or any tips on how to get around this? Thanks in advance!Question on International Shipping/International Forwarder?"
520,Etsy,"I wasn’t having any luck looking online for my specific question so I’m wondering if anyone here can answer it.
When you’re making your listing you do your title tags and your keyword tags. But then there’s an option for material tags and I only use three materials cotton, insulation, polyester

I am wondering if you can use the remaining 10 tags to promote your listing. For example can I add in white fabric, or bird print and it will still show up or do I have to keep it to materials only? 

I hope this question makes sense because I couldn’t find an answer on itQuestion about Etsy Material Tags"
521,Etsy,"Hello fellows,

Would like to know how do you think of promotion. Does it boost sales? Or make you more willing to buy?

I personally don't use promotion on my store and won't make purchase just because it's on sale. I offer the best price I can, and a promotion might make me lose profit. But on the other hand, I can set the price higher and then apply a promotion to make the price the same but looks different. What do you guys think? Thanks\~Does ""promotion"" really attract people? Need ideas from both sellers and buyers."
522,Etsy,"I've got messages from 5 customs saying that their packaged are delayed in shipping , one said his package was delivered but stolen out of a lockbox... is anybody else having trouble or is it just the Casper wyoming mail centerThese shipping delays are getting ridiculous"
523,Etsy,"Hey guys :)


So back in January, I ordered something from an Etsy shop based in Canada, and the shop shipped it out the next day. 


Fast forward to yesterday and the item hasn't arrived, so I messaged the shop owner asking if they could run a check to see where the parcel is. They responded saying that they used an Etsy label which doesn't have tracking. 


Is this true? I personally have never used an Etsy label and don't know how they work, but I do find it weird that they don't have tracking.


As for my parcel, the shop owner advised me to wait for another week, but honestly I can't see it showing up in that time :(No tracking for Etsy labels?"
524,Etsy,"I work in fintech industry and seeing firsthand lack of financial discipline and awareness by many business owners. I focus primarily on online/e-commerce vendors who turn under USD 1 mm per annum.

Biggest problem is that for many of you guys your number one concern is running your business. However, too many ignore proper financial management such as liquidity planning and selecting right financial products for their business. Best solution for you would be CFO however most cannot afford to hire such a person.

Therefore I am building a digital CFO that will be a mobile app. You will have 24/7 live financial picture of your business, including key KPIs on your financial health The idea is to steer your business in the right financial direction as you grow.

To help me build my product in the right direction I wanted to run a small focus group where I can focus on your specific needs and financial pain points.

I implore anyone interested to please respond to this post and/or DM me. I very much look forward to speaking to any of you guys.Anyone in need of digital CFO to cover the financial aspect of managing your business while you focus on operations and business development?"
525,Etsy,"I bought a pretty custom ring from a seller back in mid December. They had wonderful reviews, and pretty much everything looked similar to the pictures that were listed so I felt really confident. I reached out with some questions about customizing it and she told me that would be no issue at all (My husband passed away suddenly in a car accident, and I lost a lot of weight from the stress so my rings don't fit very well anymore. I wanted to continue wearing something meaningful, which I explained). We seemed to get everything sorted out, and I just waited.

A couple days ago I got my ring, and I was upset to discover it not only didn't look anything like it was supposed to, but it was also way bigger and doesn't fit me. It is my order for sure because it has the right customizations (my husband's initials), just nothing else, and I'm honestly not sure what happened? I don't want to ask for a refund because I'm sure she still did work hard on it, and I don't want to leave a bad review, but tbh I just feel super sad. I sent her a message that day but haven't been responded to, and I'm not really sure how to approach this now. How do I handle this appropriately?Not really sure how to deal with this?"
526,Etsy,"I’m talking about projects that we get from Cricut access. I know other people or even Cricut makes the designs available, but if we alter it somehow and even use different colors, are we able to sell them? I don’t see anything on Cricut that says we can’t sell the designs we use from their platform. I mean, we use their fonts on things we sell. I’m fairly new to the Cricut space, so any help with this will be great! I’m sure if we use our own materials we can sell them. I’m not sure!Hey, all! Is it okay to sell projects you make with your Cricut?"
527,Etsy,"Hello.

I'm preparing to open my Etsy digital shop and I'm wondering about how to organize categories inside my shop. To describe everything clearly I will use an example of selling digital prints.

Let's say I will be selling different styles of prints with various colors. If I will have my own website I will make categories by style - for example: boho, marble, neon, animal prints, etc. I will make also categories by colors - for example: black &amp; white, gold, rose gold, blue, etc.

But I'm wondering what categories create in my Etsy shop. Should I make categories by styles &amp; colors? What if I'll want to sell something else and not only digital prints (but still similar items so creating another shop will be not the best idea).  

For me, shop like that will look better and will be easier to navigate for potential clients but I will need to make multiple listings for the same item (for example: gold leopard print will be in categories ""gold"" and ""animal prints""). When I'm checking other shops almost all of them have a mess in categories and look ugly. I don't know maybe people don't care about things like that but for me, it looks bad. If I will not make categories as I mentioned above then it will be hard to find something in my shop. But maybe no one is looking for items inside the shop but only from search?

Please give me any advice because my head almost explodes when I'm thinking about how to solve this problem. 

English is not my main language so sorry for any mistakes.How to manage categories in my Etsy shop?"
528,Etsy,"At what point do you give your shop a makeover due to things not selling?

It's been a month and I've only made two sales. Both of the same item. I have 20 something items available.

Am I just not waiting long enough to gain traction? Or should I switch up my shop to get sales.

I tried ads and didn't get any sales from them so I stopped them. I tried Instagram and I'm getting a few more views (for free) so I'm keeping up with that. But still... not many sales at all.Getting things to sell"
529,Etsy,I am looking to get a design on a motel keychain to sell on my etsy shop. Does anyone have any recommended suppliers/printers that have a low minimum quantity?Motel Keychains Suppliers/Printers - Low minimum
530,Etsy,One of my customers bought 2 of my jewelry box on February 15 and Ive been keeping tabs on the status for shipping. One thing that I did notice was that the shipping label was different. The normal ones Ive been using are vertically but her shipping label was horizontal so I found that weird but it seemed to work. Anyways in the shipping status it says “in transit” since February 20 and Im worried since I want all my customers to receive my items. She hasn’t contacted me about the items but I want to contact her to ask her if she received it but Im not sure what to do! This is the first time happening any advice?Shipping in transit!
531,Etsy,"I was looking through Etsy for a customizable beaded word necklace but could not find anything- I probably am not using the correct terminology. But I figured I would ask people here if their shop sells them/knows someone who does? I'd love to buy from someone I've interacted with ahha. I attached a picture for [reference](https://imgur.com/a/Afkty8K), but I would want mine to say something else :)

(Also I read through the rules and I think this is okay here but if not I will delete and ask somewhere else)Beaded Necklaces?"
532,Etsy,"Hi, I am uploading my downloadable birthday card.

What type of file I give to my client? Does png enough? Do you also need to give the PSD file?Question about downloadable"
533,Etsy,"I'm looking for an online service that prints on thick paper like cardstock but the it needs to be around 60x90 cm or custom dimensions

Thank youService for printing on giant cardstock (or thick paper) front and back"
534,Etsy,I changed my shop name a little over a week ago and I noticed old links are not redirecting to my new shop. I thought they redirected traffic for a period of time so people could find you again?Shop name change
535,Etsy,"A international buyer purchased an item 2 months ago and it was shipped out to him, landed in his home country, and then sent back to the US.  He is asking for a refund, what can I do?International shipment now delayed 2 months, refund the buyer?"
