,subreddit,text
0,Etsy,"Hi! Welcome to the monthly critique request thread. When you post asking for a critique remember there's certain rules you must follow:

You must come with at least one specific question. No ""I just opened my shop, what should I fix?"" If that is your question you probably want to ask how you can improve your tags, or photos, or titles, or descriptions.

Let us know how long you've been open and if you're using Promoted Listings.

If you are possibly infringing on another parties intellectual property it will likely be addressed in the critique. Requests that devolve into discussions or arguments about infringement will be removed. We don't support the unlicensed use of other's intellectual property.

If you are found to be reselling non-handmade products your posts will be removed. We don't support resellers.

Before you ask for help, especially if you're new to selling, give yourself a quick shop critique with the high points most new sellers miss:

* Am I using phrases that apply to your item instead of single word tags?

* Am I using all 13 tag spaces?

* Am I using all 10 image slots?

* Are my pictures correctly white balanced? Do they look good next to other pictures in search results?

* Am I using most of the characters they give me for my title, stuffing it full of my tags and keywords?

* Do I have policies and my about page filled out? Do I have a banner, a shop icon, and my user pic in the about section?

* Am I infringing on anyone's copyright, trademark, or right to publicity? Is my artwork original?

Thanks!Critique, Help, and Feedback Requests - March 2021"
1,Etsy,"Share Your Stuff - March 15th thru 21st, 2021"
2,Etsy,"Somewhere along the way, this sub has become dominated by posts either by sellers decrying the ""worst buyer ever"" (bonus points if you call them a Karen), or by buyers with the patience of a saint asking timorously if they should open a case despite not having received the item they were promised six months ago. I think the former likely influences the latter - the prevalence of stories about nightmare buyers seems to make people think that a seller has to have threatened your life in writing before it's okay to open a case!

Buyers: if a seller is fobbing you off; pushing a shipping deadline back over and over; has sent you the wrong thing and is refusing to help; is ignoring your messages and you've still not received what you paid for; *it's okay to open a case!* Yes, do try patience and understanding first; don't open a case without making an attempt to contact the seller; do in most situations message the seller first before leaving a one star review to give them the chance to remedy things (not to extort them, but to make them aware there's an issue). But remember that this is a *business transaction*. This isn't Sunday afternoon visiting at the retirement home with your grandma where opening a case is the equivalent of flinging a cup of tea in her face. Yes, you have the responsibility to be reasonable as a buyer, but you are *not* individually responsible for the success of a shop.

I just see so many people incredibly reticent to stand up for themselves when the seller is blatantly taking the piss. Yes, it's mostly sellers here, and yes they're very vocal about bad buyers - everyone needs a rant from time to time - but that doesn't make all complaining buyers bad! Some sellers are bad too, and when you come across one you don't have to post here asking for permission to advocate for yourself.""Can I ask for a refund?"" ""Should I open a case?"" ""I don't want to ruin their shop!"""
3,Etsy,"Just did a breakdown on the economics on my shop and it's not looking good anymore..

My latest sale brought in $39.98 and I have their recommended free shipping over $35 turned on.

Lets see where we land..

* Inventory $6.00
* Shipping $10.80
* Packaging $5.40
* (Mandatory) Advertising $4.80
* Transaction Fee $2.00
* Payment Processsing Fee $1.45
* Listing $0.40
* Renewal $0.20

Net Profit $8.93..

Absolutely insane.. I went months not realizing how bad it's gotten. As a vintage seller, all I'm doing is finding inventory and packing boxes, I have absolutely no idea how those of you who actually have to create your items are doing it with these margins but I commend you on successfully doing so. For over a decade I'd try to purchase items at about 50% of my final sale cost.. doing so now results in a large net loss.Etsy with mandatory off-site ads is an absolute profit vampire."
4,Etsy,"I opened up a shop this year and made about $11k in revenue in 2020. First time small business owner so doing taxes for this is completely new to me. I have read that Etsy is now supposed to be collecting and remitting sales tax for orders automatically.

I'm looking at my financial statements for the year and things aren't adding up. Under the Fee and Tax column in my payment account page every transaction has two different charges from Etsy - one for ""sale"" and the other for ""transaction"". My assumption is that the ""sale"" fee that Etsy charges me is for sales tax and the ""transaction"" fee is the cut that they take for every transaction.

The problem is that the ""sale"" fee doesn't match the sales tax that was charged to my customers for each order. So is that ""sale"" fee not for sales tax? 

To complicate things further, I tried exporting the CSV from Settings &gt; Download Data &gt; Orders (2020) page like so many tutorials suggest and in that CSV file the entire sales tax column is showing as blank for all of my orders. I know for a fact this isn't correct because I've looked at each order and they all have sales tax added onto them.

So what the hell is going on here? Do I have to pay all of these back taxes in sales tax to the state when I file? Or is Etsy paying them? 

And FWIW Etsy freaking SUCKS. I hate this platform, the fees they take are ridiculous and the tools they offer are AWFUL.Desperately need help with taxes for Etsy shop"
5,Etsy,"Hello. I am afraid I hurt someone's shop. I requested a refund because I misunderstood a listing I bought due to a language barrier. They refunded me. I am pretty inexperienced with Etsy, and now I am really afraid I hurt their shop? It's really new (only 4 sales). Did I ruin it? Is there something I can do to help fix it?Help! I'm Afraid I Ruined Someone's Shop"
6,Etsy,"I posted at the beginning of this week about my personalised Mother’s Day onesie for my son which didn’t arrive by the date, even though I ordered it in plenty of time. It was due to be dispatched a couple of days after I ordered it and the seller was a little rude when I messaged (Thurs before Mother’s Day) to check whether it was going to be on its way soon. After asking for a refund last Sunday (Mother’s Day) due to not receiving it, the only response I have had from the seller was a generic message saying that a parent has died unexpectedly, all Mother’s Day orders were dispatched on time and someone will be fulfilling all other orders. 

On the advice of someone here, I gave it a few days because Hermes (seller said they were the carrier) can be unpredictable. The onesie turned up yesterday, almost a week after Mother’s Day. Here are my issues:

- It was not sent via Hermes. It was sent Royal Mail, I think 1st class. It also said “post by 20th March” on it, which was yesterday, so I strongly suspect it‘s only recently been dispatched. The seller has not been truthful here. 

- It is appalling quality. I only undid one of the poppers and that one fell off. 

- To top it all off, my son’s name is spelled incorrectly on it. It’s not an unusual name but there are two ways of spelling it and both spellings are commonly used. I checked and I spelled it correctly on the order. 

I suspect that this has been hastily done and only dispatched a couple of days ago. I obviously understand given the circumstances that it hasn’t been easy but I would have much preferred my order to have been cancelled and refunded than receiving something totally useless  a week late. 

I have left a 1 star review and in it said I will be asking for a refund. The shop is “taking a break” at the moment, which is fine, but that could be weeks and I don’t know if there’s a refund window for purchases. 

So is it best to open a case?Should I open a case or contact the seller again?"
7,Etsy,"Quick question, I see some shops doesn't have a ""Returns &amp; exchanges"" in their ""Shipping and return policies"" section (on product pages, see photo). Any idea how they do it? THX!!

&amp;#x200B;

https://i.imgur.com/BYm02Da.pngHow to hide the Returns &amp; exchanges on product pages"
8,Etsy,"It's my first time sending a parcel from UK to USA and after research I am still unsure whether the purchaser of my product will have to pay additional taxes on it. It is a small framed artwork valued at around £20. My understanding is that it may be up to US customs as to how much to tax it depending on the item? But if they do get taxed is it likely to be a significant amount and is this something I should bring up with the customer and offer to pay for, or is this just something that is widely accepted when sending internationally.Import tax on Parcels sent to USA?"
9,Etsy,My account has finally been reopened after it was suspended for a day and now I haven’t had a single sale and my traffic and favorites are down to where I started practically. This is my main source of income I’m concerned even though my 5 star reviews are all still there that my stuff isn’t showing up in searches anymore or being recommended to anyone. Has anyone had experience with this? How long did it take to get back to normal? My shop is 5 years old and has lots of good reviews but my views went from hundreds a day to like 30 a day.Reopening after suspended
10,Etsy,I have created a store around 2 months ago and i got my first two orders in first week and withing first week they disabled my account without any reason. I emailed the customer support but never heard back. I was selling digital product . It was a premium fonts collection.Why Etsy Disable accounts without even notfying about any violation?
11,Etsy,"I'm a seller and I have a customer who's package is stuck in German customs since March 1st with no indication when it will be released or if ever will be. In situation like this, who is in the best position to inquire about the delay? It doesn't seem like there is a customs and duties charge as she mention none of it.Package stuck in customs"
12,Etsy,"hey, id like to buy a vivienne westwood dupe on etsy. i found a shop that claims to have these but they only have 14 sells, joined etsy in 2021, they have PLENTY of discounts and 'buy x items and get y% off' deals going on and overall just seem 'too good to be true'. the original necklace im looking for is pretty rare and sold out everywhere. can someone please help me figure out whether or not theyre trustworthy? id greatly appreciate any advice.

heres the link:

https://www.etsy.com/listing/967909062/vivienne-westwood-oversized-pendant?ga_order=most_relevant&amp;ga_search_type=all&amp;ga_view_type=gallery&amp;ga_search_query=vivienne+westwood+necklace&amp;ref=sr_gallery-1-34&amp;from_market_listing_grid_organic=1&amp;pro=1&amp;frs=1&amp;col=1&amp;variation0=1866403876First time buying on Etsy"
13,Etsy,"Everytime I try to purchase an item with my payment app I get a notification app from Etsy saying ""Uh oh, there was a problem"" does anyone know how to fix this?Uh oh, there was a problem"
14,Etsy,"Hello, I am a new buyer from Etsy, it is a great resource for tabletop gaming. I recently made two different purchases from two different sellers, both in different countries. (Poland and Russia) Both packages have left their respective countries and no other updates have been made to either tracking number. Both say ( **08 Mar 202103:32 Prepared for shipment from RussiaSharapovo, 102972**) and  Sent from Poland2021-03-14 00:16WER Warsaw Is it possible that it's US customs just keeping them? It's been nearly a month since shipped. Just curious if anyone else has experienced this recently? Both sellers have tons of sales and Five-star ratings.Delays on international shipping from Poland and Russia to the US?"
15,Etsy,"Hi all! I make handmade oven mitts and I want to know what category it should be in? 
The nearest one I got is the pot holder category 

I’m just worried I have been putting my oven mitts in the wrong category. I feel like my sales have reeeeeallly slowed down


Thank you!What category will handmade oven mitt glove be in?"
16,Etsy,"Hello!

I can't find the info anywhere so I hope it's ok to ask here.

Instead of using my home address to conduct my Etsy business, can I use a PO BOX Address instead? Specifically in Vancouver BC.

Please and thank you!Canadian PO BOX Address for Shipping?"
17,Etsy,"This is my second time buying on Etsy so I’m not sure how to go about this. My order says it is dispatched, however the tracking number on DHL doesn’t work, and the shop I bought from has completely disappeared. I’ve emailed the seller and messaged them on Etsy so I’m waiting for a reply. Have I been scammed or is this normal? I would love any advice, thank you!Help! I can’t track my order and the shop is gone"
18,Etsy,"Hi ! So, I recently learned that your keywords must be in the language of your shop to work. My shop language is in French, but I do digital prints, so a lot of them have sayings in English. Also, I feel like there isn’t really keywords for this niche in French, and most of my customers are from the us and not from my country. The problem is, right now, none of my traffic comes from keywords/search on Etsy so I feel like I would be much more successful if I could get sales directly from search. Should I switch my shop language to English ? If you’re an Etsy seller whose shop isn’t in English, what is your strategy and are you successful ?Etsy SEO by language"
19,Etsy,"I ordered a chain a month ago and last week on the esty tracking and it write attempted delivery abroad. I havent gotten a call from any delivery company neither an solution from my local post office that says they havent recived any package. Idk what to do, i dont know whats the tracking number or which way i got sent the package the seller just says contact your local post office. I dont want to just ask for a refund if i still can get the chain what do i do?
On esty tracking it says shipped with global post shipping. No idea which company that is.Attempted delivery abroad. Never got an notification"
20,Etsy,"Help! My buyer didn't pay customs and parcel stuck.

I run UK based shop, I got order for three heavy knitted items to be shipped to France. I have chosen DPD as the cheapest and safest shipping option and shipped within 1 day, insured (at my own expense) and with all the customs papers correctly filled. Parcel made it to France super quickly, I was able to track it, I of course provided tracking number to Etsy and also DM it to the buyer.

Days went by and parcel didn't move in tracking. After customs being sorted out, no progress whatsoever. I eventually contacted the buyer. And she was like ""oh so this is why X (DPD's French partner) asked me to pay customs. Now I understand it is THE parcel from you. Well, I had issues with paying the customs"". And you tell me NOW ? She also claimed her tracking didn't work (it worked for me, in case of issues she could have contacted me).  And that she thought that customs were included in what she paid, despite me sending her a very clear message saying YOU MAY HAVE TO PAY EXTRA CUSTOM CHARGES ONCE IT ARRIVES. She took some actions in order to clarify it with X services after my message. At least that's what I was told. But it was too late to pay customs and she was told parcel will be returned to sender. She apologised etc. Now this parcel is most likely lost, I'm in touch with DPD customer service hoping it will be returned to me somehow one day. Buyer however had a very unpleasant convo with me yesterday when we discussed circumstances of the whole event. She claims that she receives many parcels from abroad so it's **obvious** that she didn't immediately connect customs issue with THIS parcel, duhh. But if it was me, and I had issues with completing customs payment, I would find which parcel it is that I can't pay for and at least would inform the seller ! Buyer insists she did everything to receive the parcel and I can't agree. Am in the wrong here ? She got ultra upset and offended when I suggested that there was not enough done at her end in order to receive the parcel and avoid current situation. Because I really feel that I did everything I could, and could have done more if I was informed ON TIME that she can't have her customs paid due to some email-phone number issue. So yeah, am I wrong here ? Btw I'm assuming she's telling the truth about inability to pay the customs due to some error, although her mentioning how high the customs charges are few times and suggesting that I could re-send it once it's back to me with other services because she heard it is cheaper and customs also could be lower, is kind of a red flag for me and makes me question her explanationBuyer didn't pay customs, didn't inform me, now parcel is probably lost"
21,Etsy,"So I was scrolling through stuff on Etsy to randomly shop when one of the pictures shown for a popular search named ""Collar Ring"" showed a boob, nipples and all! Lol . Now I'm no prude but this is something I definitely wouldnt like popping up on my screen when I'm at my in-laws lol. So ... Wth lmao 

Just in case someone suggests it's based on my searches, let me tell you all my research is always done inside an actual store to avoid stuff like that ever appearing on my feed in any website LmaoDid anyone else get that naked boob picture under popular searches ?"
22,Etsy,"So about a month ago I got an order (a bronze sword) from a person that lives in Australia. My shop is located in Greece (I make handmade bronze statues that are 100% made by me using the method of casting). 

Everything went smoothly , the item was shipped in time etc. Suddenly 2 days ago the buyer sents me a message demanding a 35$ refund because as he said ""The item doesn't match its' description and looks better in the pictures."" I have to tell you that we sent him the exact same sword he requested and in the listing details the size of the sword is crearly stated correctly (9.5 inches in length). 

When we told him that the statue is actually the correct size he requested a refund. We gladly accepted ofcourse but he demanded we pay for the shipping costs as well. Now I have to point out that in our shop policies we have stated that we accept refunds/returns as long as the buyer pays for the shipping cost.

Ofcourse he refused to pay the shipping and called us a ""ripoff"". He made a case on the sale and then gave us a bad review as well on Facebook.

We messaged him with screenshots and photos of the same sword in our workshop that prove that the sword is actually the correct size but he said that he will contact PayPal and he will do it the hard way now that we didn't pay him back the 35$.

Is there something we can do? He clearly has bad intentions and I don't wanna see a bad review on etsy. I have made more than 250 sales so far for the past 4 years and have never had such a bad experience with a buyer.A buyer made a case on my shop"
23,Etsy,"Hi!! I've recently heard that a Tiktok account for your Etsy shop can really help improve sales and reach. I started one today, and I'm wondering if anyone has any tips to get started or to gain followers, do's and don'ts.. etc. Im here for all the advice!! thanks in advance !!!TIKTOK FOR ETSY SHOPS"
24,Etsy,"This girl is the sweetest buyer I’ve ever met. She ordered a customized picture frame from me. I shipped it all the way from Toronto, Canada to Mississippi and sadly it arrived broken. 

She said this sometimes happens with her UPS packages as the delivery person just drops them and they shatter. I felt so terrible and immediately offered to refund her or replace it at no cost. I profusely apologized and thanked her for being so nice. 

That’s when she thanked ME for being so nice because apparently the last time she ordered something from Etsy and it was broken on arrival the seller basically said she’s SOL and made her pay again to replace it. 

How sellers can do that is beyond me. I understand things break during shipping and it’s beyond our control - yes it sucks, but I definitely don’t think it’s the buyers responsibility to buy it again if they want it. Broken packages are a cost of business.

I wouldn’t even fathom making a buyer pay again for something when it’s technically my fault it broke and they hadn’t even touched it before it broke. I don’t just do this because I don’t want a bad review but I just can’t in good conscience make someone spend hard earned money twice on something that’s my fault. 


TLDR; package shattered in the mail and the buyer said thanks for being so nice for offering the replace it at no cost because the last Etsy seller she had a broken package with said she had to pay again if she wanted a replacement.A package I shipped arrived broken - and the buyer is thanking ME for being so nice for offering to replace it for free? I feel bad for whoever screwed her over before😭"
25,Etsy,For context text I ordered something on January 8th. The things takes a month to cure and such so I expected to get it before Valentine's day and then that came and went. I have contacted the seller multiple times they ensured me the first time that they were sending it out that week. A week later I contacted again asking for tracking information got none and was told it would be shipped out in a week. 10days and I still have no items and no shipping info. I feel bad but I feel like I've been more than understanding. Another mention their shop is literally a town over from where I live so even with shipping it shouldn't take long once they send it.Should I open a case?
26,Etsy,"Hi everyone! 
I'm a beadsmith (I guess that's the term?), who mainly designs and makes goth/victorian style jewelry. 
I'm fairly new to Etsy as a selling platform, mainly because I was previously unable to ship items abroad (I'm based in Argentina and it's a nightmare to try and sell outside of our country), but I've finally found a trustworthy  and efficient way of doing it and I've begun my attempt at going worldwide.
Thing is, I have been selling domestically for a few years and have been lucky enough to amass a few loyal customers. The question is, is it important for potential buyers out there to find a section with ""happy clients"" to look through in my media? Would it help build people's trust that I indeed fullfil my orders and deliver what I advertise? 
Thanks so much for your feedback!Is it important to share client pictures?"
27,Etsy,"Lets say I try to sell custom PC cases for PC hardware enthusiasts, but need a few small electronic parts such as a power button/USB, etc. Is my only option to go to AliExpress, or amazon and buy really cheap Chinese knockoff brands that last a week before falling apart according to review? Like what if my product included [this Fractal Design](https://www.amazon.ca/Fractal-Design-Upgrade-Components-FD-ACC/dp/B07DSGN15V/ref=sr_1_13?dchild=1&amp;keywords=front+panel+audio+connector&amp;qid=1616305026&amp;sr=8-13#customerReviews) front electronic panel/replacement name brand part as part of what I'm building. I'm guessing I'd be infringing on some pretty hardcore copyright claims? Fractal Design is a pretty popular German PC case maker. Nothing on that part is actually branded as Fractal Design except maybe a parts number. I'm guessing I'd just get a warning/cease and desist notice if someone ever finds out, right?What if your product contains other name brand products/parts?"
28,Etsy,"I put a bunch of packages out to ship, and now none of them are updating on etsy, and customers are losing it. I don't know what to do, is this just a temporary technical issue that I can wait out, or is usps taking down the tracking option for a bit??USPS package tracker is temporarily down, and its causing customer hell."
29,Etsy,"I contacted an Etsy seller about a product and asked about customisation. They responded within a day indicating they do customise. 

I responded with some specs and questions, but no reply. Gave a nudge, and no reply.

It's been a week. 

It's there an issue with the messaging system? Are they overwhelmed? Ignoring me? Incapacitated? Dead?

Site says they typically respond within a day.

I dunno - anyone been ghosted by an Etsy supplier?Etsy Messaging"
30,Etsy,"Hey, 

Im about to join etsy seller, but my father doesnt want me to input my ssn number down. I noticed that when I was signing up, if I put my country of residence in United States, it would further ask me to enter my last 4 digit number of my ssn,but when I put my country of residence as like United Kingdom, it didnt ask for my ssn. Would it be okay to put my residence down as United Kingdom so I dont have to put my ssn in?quick question on last ssn numbers"
